{
  "schema_version": 1,
  "ontology_id": "geosync.operational_definitions.v1",
  "policy": {
    "purpose": "Operational definitions of the physics/neuroscience vocabulary so a metaphor cannot be mistaken for a mechanism. Every ACTIVE mechanism term must carry a mathematical object, an observable->math mapping, units, a validity domain, alternative hypotheses, and a falsifier. Terms with no admissible operational mapping are RETIRED (tombstone) or explicitly labelled ANALOGUE (arithmetic proxy, non-claim).",
    "statuses": {
      "mechanism": "A rigorous mathematical object with an observable->math mapping and an executable falsifier. Backed by P0/P1 invariants in the registry. This IS a claim.",
      "analogue": "An engineering/arithmetic proxy that borrows a biological or physical name. The name is metaphorical; no biological or physical mechanism is asserted or measured. NON-CLAIM (per INV-HOM1).",
      "retired": "A former term whose framing was a category error or was falsified/withdrawn. Preserved as negative evidence (tombstone). Never backs a live claim."
    },
    "gate": "scripts/ci/check_terminology.py validates every term against schemas/operational_definition.schema.json and fail-closes when: an ACTIVE mechanism term lacks a math_object/observable_mapping/falsifier/alternatives; a metaphor-only term is labelled mechanism; or a term declares an unknown status.",
    "source_of_truth": "CLAUDE.md INVARIANT REGISTRY; governance/project_state.yaml (current_state: RESEARCH_ALPHA); FORBIDDEN_CLAIMS.md."
  },
  "metaphor_only": [
    "serotonin",
    "dopamine",
    "gaba",
    "heisenberg_uncertainty"
  ],
  "terms": [
    {
      "name": "synchronization",
      "status": "mechanism",
      "is_claim": true,
      "aliases": ["sync", "phase_synchronization", "order_parameter", "coherence"],
      "math_object": "Kuramoto order parameter R(t) = |(1/N) * sum_{j=1..N} exp(i*theta_j(t))| in [0,1], complex form z = R*exp(i*psi). Critical coupling K_c = 2/(pi*g(0)); Lorentzian K_c = 2*gamma.",
      "observable_mapping": "Per-node phase theta_j(t) is extracted from the analytic signal (Hilbert transform) of each detrended asset log-return series; R is the modulus of the mean phasor. Coupling K is estimated from the empirical coupling graph. z lives on the unit disk.",
      "units": "dimensionless (R, z are pure numbers on the unit disk; phases in radians; K, K_c, gamma in inverse-time coupling units)",
      "validity_domain": "Finite N ensembles of phase oscillators. Asymptotic laws (INV-K2/K3) hold as t->inf with a finite-size floor <R> ~ O(1/sqrt(N)); use epsilon = 3/sqrt(N), never a magic number. Not a claim about market predictability.",
      "alternatives": [
        "Spurious coherence driven by a common exogenous factor (market-wide beta) rather than endogenous oscillator coupling",
        "Finite-size fluctuation: R ~ O(1/sqrt(N)) can masquerade as weak synchrony in small ensembles",
        "Non-stationarity or phase-slip artifacts of the Hilbert phase extraction",
        "A single dominant mode aliased as global synchrony"
      ],
      "falsifier": "INV-K2: R(t) > 3/sqrt(N) after 1e4 steps at K = 0.1*K_c with N > 100 (a subcritical ensemble must decohere to the finite-size floor). Also INV-K1: any R(t) outside [0,1].",
      "invariants": ["INV-K1", "INV-K2", "INV-K3", "INV-K4", "INV-K5", "INV-K6", "INV-K7", "INV-K8", "INV-K9", "INV-K10", "INV-OA1", "INV-OA2", "INV-OA3"],
      "source": "core/kuramoto/, core/kuramoto/ott_antonsen.py"
    },
    {
      "name": "curvature",
      "status": "mechanism",
      "is_claim": true,
      "aliases": ["ricci", "ollivier_kappa", "ollivier_ricci", "kappa"],
      "math_object": "Ollivier-Ricci curvature kappa(x,y) = 1 - W_1(m_x, m_y)/d(x,y) on a weighted graph, where W_1 is the Wasserstein-1 distance between lazy-random-walk measures m_x, m_y and d is the graph metric.",
      "observable_mapping": "Nodes = assets/price levels; edges carry an empirical distance (de)correlation or spread metric; kappa is computed per edge via optimal transport. build_price_graph uses consecutive-integer node IDs so the combinatorial distance matches the 1D positional embedding.",
      "units": "dimensionless (kappa is a normalized transport ratio); kappa <= 1 universal",
      "validity_domain": "kappa <= 1 for any connected graph (INV-RC1). kappa in [-1,1] ONLY for build_price_graph output (INV-RC3); the 1D positional embedding can drop below -1 for other topologies. Forman-Ricci is a DISTINCT object and is never kappa-bound evidence (category-error guard, INV-CBR1).",
      "alternatives": [
        "Metric-embedding artifact: the chosen 1D positional embedding, not market geometry, drives the sign",
        "Sampling noise in the correlation matrix producing spurious negative curvature",
        "Category confusion with Forman-Ricci, which is bounded differently and may exceed 1"
      ],
      "falsifier": "INV-RC1: kappa > 1 returned for a connected graph. INV-RC3: kappa outside [-1,1] for build_price_graph output. INV-KR4: a signed kappa silently clipped at the Restrepo-Ott-Hunt onset boundary without RicciAdjacencyAudit metadata.",
      "invariants": ["INV-RC1", "INV-RC2", "INV-RC3", "INV-KR4", "INV-CBR1"],
      "source": "core/kuramoto/kuramoto_ricci_engine.py, coherence_bridge/physics_contract.py"
    },
    {
      "name": "energy",
      "status": "mechanism",
      "is_claim": true,
      "aliases": ["potential", "lyapunov_functional", "free_energy", "swing_energy"],
      "math_object": "Model energies: Kuramoto coupling potential V = -(K*N/2)*R^2 (all-to-all, omega=0); second-order swing energy E = 0.5*sum(m*thetadot^2) + V; variational free energy F = U - T*S_q (Helmholtz form).",
      "observable_mapping": "Computed from the same phase state theta and coupling K as synchronization; free-energy components (U = precision-weighted prediction error, S_q = variational entropy) from the active-inference model state. No physical Joules -- these are chosen Lyapunov functionals of the model state.",
      "units": "model-energy units (dimensionless under normalized coupling). F and V may be negative (Helmholtz); components U, T, S_q >= 0",
      "validity_domain": "V is non-increasing only with omega_i = 0 (INV-K7); swing energy is conserved (omega=0, d=0) or non-increasing (omega=0, d>=0) (INV-K8/K9); F is non-increasing under active inference (INV-FE1). NOT the thermodynamic energy of the market.",
      "alternatives": [
        "Integrator artifact: Euler introduces secular growth that mimics energy injection",
        "The 'energy' is a chosen Lyapunov functional, not a conserved physical quantity -- descent can be true by construction",
        "A damping sign error that injects rather than dissipates"
      ],
      "falsifier": "INV-K8/K9: swing-energy secular growth (log-log slope collapse 2.01 -> 0.81) under a symplectic integrator, or +d*thetadot producing energy injection. INV-FE1: F(t) increasing under active inference. INV-FE2: any component U, T, S_q < 0.",
      "invariants": ["INV-K7", "INV-K8", "INV-K9", "INV-K10", "INV-FE1", "INV-FE2", "INV-OMS1"],
      "source": "core/kuramoto/second_order.py, ECS free-energy layer"
    },
    {
      "name": "entropy",
      "status": "mechanism",
      "is_claim": true,
      "aliases": ["entropy_production", "shannon_entropy", "variational_entropy"],
      "math_object": "Thermodynamic entropy production sigma >= 0 (second law, INV-TH2); variational entropy component S_q >= 0 in F = U - T*S; Shannon/Rayleigh phase entropy for the incoherent-phase test.",
      "observable_mapping": "Entropy production from the before/after state of a dissipative update; S_q from the approximate posterior over latent causes; phase entropy from the empirical phase histogram (uniform on [-pi,pi] under INV-K6 in the subcritical regime).",
      "units": "nats (Shannon/variational, natural log) or dimensionless model units; entropy production >= 0",
      "validity_domain": "Entropy production >= 0 holds for the modeled dissipative dynamics (INV-TH2). The Jarzynski/second-law bounds (INV-ST2/ST3) are pure statistical mechanics on the overdamped Langevin harness, NOT a market model.",
      "alternatives": [
        "Estimator bias: finite-sample entropy is biased low, so apparent production may be estimator drift",
        "Binning/discretization artifact in the phase histogram",
        "Non-stationarity mimicking entropy production"
      ],
      "falsifier": "INV-TH2: measured entropy production < 0. INV-ST2: Jarzynski <exp(-beta*W)> deviates from exp(-beta*dF) beyond tolerance. INV-K6: subcritical phases fail the Rayleigh uniformity test.",
      "invariants": ["INV-TH1", "INV-TH2", "INV-ST1", "INV-ST2", "INV-ST3", "INV-K6", "INV-FE2"],
      "source": "core/physics/stochastic_thermodynamics.py, ECS free-energy layer"
    },
    {
      "name": "phase_transition",
      "status": "mechanism",
      "is_claim": true,
      "aliases": ["bifurcation", "sync_onset", "critical_coupling", "explosive_sync", "hysteresis"],
      "math_object": "Synchronization onset at K_c = 2/(pi*g(0)) (Lorentzian K_c = 2*gamma); order-parameter bifurcation R_inf proportional to sqrt(K - K_c); Restrepo-Ott-Hunt boundary Phi = K*lambda_max(A_kappa) - 2*gamma with sign(Phi) selecting the asymptotic regime; explosive-sync hysteresis width >= 0.",
      "observable_mapping": "K_c from the natural-frequency dispersion g(0); Phi from coupling K and the leading eigenvalue of the kappa-adjacency A_kappa; regime read from asymptotic <R> (subcritical <R> <= 1.5*3/sqrt(N) vs supercritical > 0.5).",
      "units": "K, K_c, gamma in coupling units (inverse time); R_inf, Phi dimensionless",